{
  "title": "Festival Lights",
  "story": "The town of Lumiville is preparing for its annual festival. The main parade route has N lanterns arranged in a straight line, numbered 1 to N. Each lantern i consumes Pᵢ units of electrical power. The town has a single portable generator with a power capacity of S units. The generator can power any contiguous segment of lanterns, but the total power consumption of all lit lanterns must not exceed S. The festival committee wants to illuminate as many consecutive lanterns as possible to create the most impressive visual display.",
  "statement": "You are given N lanterns with power consumptions P₁, P₂, ..., Pₙ and a generator with capacity S. Find the maximum number of consecutive lanterns that can be simultaneously powered such that the total power consumption does not exceed S.\n\nFormally, find the maximum value of (r − l + 1) such that 1 ≤ l ≤ r ≤ N and P_l + P_{l+1} + ... + P_r ≤ S. If no such pair (l, r) exists (i.e., even a single lantern exceeds S), output 0.",
  "input_format": {
    "line_1": "Two space-separated integers N and S — the number of lanterns and the generator's power capacity.",
    "line_2": "N space-separated integers P₁, P₂, ..., Pₙ — the power consumption of each lantern."
  },
  "output_format": "Print a single integer — the maximum number of consecutive lanterns whose total power consumption does not exceed S.",
  "constraints": [
    "1 ≤ N ≤ 10⁵",
    "1 ≤ Pᵢ ≤ 10⁹",
    "1 ≤ S ≤ 10¹⁴",
    "Time limit: 1 second",
    "Memory limit: 256 MB"
  ],
  "sample_tests": [
    {
      "input": "5 6\n3 1 2 4 1",
      "output": "3",
      "explanation": "We need the longest contiguous subarray with sum ≤ 6. The subarray [3, 1, 2] (lanterns 1–3) has sum 6 ≤ 6, giving length 3. All subarrays of length 4 have sums exceeding 6: [3,1,2,4] = 10, [1,2,4,1] = 8. So the answer is 3."
    },
    {
      "input": "5 4\n5 2 8 1 1",
      "output": "2",
      "explanation": "We need the longest contiguous subarray with sum ≤ 4. Lantern 1 (power 5) and lantern 3 (power 8) individually exceed S = 4, so they cannot be included. The valid segments are: [2] (length 1), [1, 1] (lanterns 4–5, sum 2, length 2), and [2] alone (length 1). The maximum length is 2, from lanterns 4–5 with sum 2 ≤ 4."
    },
    {
      "input": "5 5\n1 1 1 1 1",
      "output": "5",
      "explanation": "All lanterns have power consumption 1. The total sum of all 5 lanterns is 5 ≤ 5 = S. Since all lanterns can be powered simultaneously, the answer is 5."
    }
  ],
  "notes": [
    "The sum of power consumptions can be as large as N × max(Pᵢ) = 10¹⁴, which exceeds the range of 32-bit integers. Use 64-bit integer types for sum computations.",
    "All power consumptions are positive (Pᵢ ≥ 1). This is essential for the sliding window approach to work correctly."
  ],
  "subtasks": [
    {
      "points": 30,
      "constraints": [
        "1 ≤ N ≤ 1000",
        "1 ≤ Pᵢ ≤ 1000",
        "1 ≤ S ≤ 10⁶"
      ],
      "description": "Small constraints — O(N²) approaches are feasible."
    },
    {
      "points": 70,
      "constraints": [
        "1 ≤ N ≤ 10⁵",
        "1 ≤ Pᵢ ≤ 10⁹",
        "1 ≤ S ≤ 10¹⁴"
      ],
      "description": "Full constraints — requires an O(N) approach."
    }
  ]
}
